<?xml version="1.0" encoding="UTF-8"?>
<menus xmlns:xs="http://www.w3.org/2001/XMLSchema-instance"
       xs:noNamespaceSchemaLocation="urn:weline:module:Weline_Backend::etc/xsd/menu.xsd"
       xs:schemaLocation="urn:weline:module:Weline_Backend::etc/xsd/menu.xsd">
    
    <!-- 队列属于框架系统服务；菜单仅暴露列表与只读诊断入口。 -->
    <menu source="Weline_Queue::message_service" name="message_service" title="消息队列" action="" 
         parent="Weline_Backend::system_service_group"
         icon="message" order="20">
        
        <menu source="Weline_Queue::listing_manager" name="queue_listing" title="队列列表"
             action="queue/backend/queue/index"
             icon="list" order="10"/>
        
        <menu source="Weline_Queue::type_manager" name="queue_type" title="队列类型"
             action="queue/backend/type/index"
             icon="circle" order="20"/>

        <menu source="Weline_Queue::consumer_diagnostics" name="queue_consumers" title="消费者"
             action="queue/backend/diagnostics/consumers"
             icon="user" order="30"/>

        <menu source="Weline_Queue::retry_diagnostics" name="queue_retries" title="重试诊断"
             action="queue/backend/diagnostics/retries"
             icon="refresh" order="40"/>

        <menu source="Weline_Queue::inbox_diagnostics" name="queue_inbox" title="收件箱"
             action="queue/backend/diagnostics/inbox"
             icon="arrow-down" order="50"/>

        <menu source="Weline_Queue::outbox_diagnostics" name="queue_outbox" title="发件箱"
             action="queue/backend/diagnostics/outbox"
             icon="arrow-up" order="60"/>
    </menu>
</menus>
