<?xml version="1.0" encoding="UTF-8"?>
<menus xmlns:xs="http://www.w3.org/2001/XMLSchema-instance"
       xs:noNamespaceSchemaLocation="urn:weline:module:Weline_Backend::etc/xsd/menu.xsd"
       xs:schemaLocation="urn:weline:module:Weline_Backend::etc/xsd/menu.xsd">
    <menu source="Weline_Points::commerce:partner:points"
          name="points_group"
          title="积分与会员"
          action=""
          parent="Weline_Backend::commerce:partner:group"
          icon="gift"
          order="50">
        <menu source="Weline_Points::commerce:partner:points_overview"
              name="points_overview"
              title="积分概览"
              action="points/backend/points/index"
              icon="chart"
              order="10"/>
        <menu source="Weline_Points::commerce:partner:points_levels"
              name="points_levels"
              title="VIP 等级"
              action="points/backend/points/levels"
              icon="circle"
              order="20"/>
        <menu source="Weline_Points::commerce:partner:points_customers"
              name="points_customers"
              title="会员成长"
              action="points/backend/points/customers"
              icon="users"
              order="30"/>
        <menu source="Weline_Points::commerce:partner:points_ledger"
              name="points_ledger"
              title="积分账本"
              action="points/backend/points/ledger"
              icon="book"
              order="40"/>
        <menu source="Weline_Points::commerce:partner:points_discounts"
              name="points_discounts"
              title="抵扣记录"
              action="points/backend/points/discounts"
              icon="cash"
              order="50"/>
        <menu source="Weline_Points::commerce:partner:points_settings"
              name="points_settings"
              title="积分设置"
              action="points/backend/points/settings"
              icon="eye"
              order="60"/>
    </menu>
</menus>
