<?xml version="1.0" encoding="UTF-8"?>
<menus xmlns:xs="http://www.w3.org/2001/XMLSchema-instance"
       xs:noNamespaceSchemaLocation="urn:weline:module:Weline_Backend::etc/xsd/menu.xsd"
       xs:schemaLocation="urn:weline:module:Weline_Backend::etc/xsd/menu.xsd">
    
    <!-- Multipass管理顶级菜单 -->
    <menu source="Weline_Multipass::menu_multipass_management" 
         name="multipass_management" 
         title="Multipass管理" 
         action=""
         icon="link" 
         order="25000">
        <!-- 站点管理子菜单 -->
        <menu source="Weline_Multipass::site_management" 
             name="multipass_site_management" 
             title="站点管理" 
             action="multipass/backend/site/index"
             icon="server" 
             order="5"/>
        <!-- 互通应用管理子菜单 -->
        <menu source="Weline_Multipass::trusted_app_management"
             name="multipass_trusted_app_management"
             title="互通应用"
             action="multipass/backend/trusted-app/index"
             icon="settings"
             order="7"/>
        <menu source="Weline_Multipass::identity_provider_management"
             name="multipass_identity_provider_management"
             title="官网登录提供方"
             action="multipass/backend/identity-provider/index"
             icon="login"
             order="8"/>
        <!-- Multipass账户管理子菜单 -->
        <menu source="Weline_Multipass::account_management" 
             name="multipass_account_management" 
             title="账户管理" 
             action=""
             icon="user" 
             order="10">
            <!-- 后端账户 -->
            <menu source="Weline_Multipass::account_backend" 
                 name="multipass_account_backend" 
                 title="后端账户" 
                 action="multipass/backend/account/backend"
                 icon="user" 
                 order="10"/>
            <!-- 前端账户 -->
            <menu source="Weline_Multipass::account_frontend" 
                 name="multipass_account_frontend" 
                 title="前端账户" 
                 action="multipass/backend/account/frontend"
                 icon="user" 
                 order="20"/>
        </menu>
    </menu>
    
</menus>
