<?xml version="1.0" encoding="UTF-8"?>
<menus xmlns:xs="http://www.w3.org/2001/XMLSchema-instance"
       xs:noNamespaceSchemaLocation="urn:weline:module:Weline_Backend::etc/xsd/menu.xsd"
       xs:schemaLocation="urn:weline:module:Weline_Backend::etc/xsd/menu.xsd">
    <menu source="Weline_Subscription::commerce:partner:control-center" name="subscription_control_center"
          title="订阅管理" action="" parent="Weline_Backend::commerce:partner:group"
          icon="refresh" order="20">
        <menu source="Weline_Subscription::commerce:partner:subscriptions" name="subscription_subscriptions" title="订阅"
              action="subscription/backend/controlcenter/subscriptions" icon="check" order="10"/>
        <menu source="Weline_Subscription::commerce:partner:periods" name="subscription_periods" title="订阅周期"
              action="subscription/backend/controlcenter/periods" icon="calendar" order="20"/>
        <menu source="Weline_Subscription::commerce:partner:renewals" name="subscription_renewals" title="续费调度"
              action="subscription/backend/controlcenter/renewals" icon="circle" order="30"/>
        <menu source="Weline_Subscription::commerce:partner:attempts" name="subscription_attempts" title="续费尝试"
              action="subscription/backend/controlcenter/attempts" icon="history" order="40"/>
        <menu source="Weline_Subscription::commerce:partner:missed-watermarks" name="subscription_missed_watermarks" title="失败水位"
              action="subscription/backend/controlcenter/missedwatermarks" icon="warning" order="50"/>
        <menu source="Weline_Subscription::commerce:partner:migration" name="subscription_migration" title="迁移状态"
              action="subscription/backend/controlcenter/migration" icon="eye" order="60"/>
    </menu>
</menus>
